{
  "specversion": "1.0",
  "id": "0198f1c2-7a41-7c3b-9d55-2f0b6a1e4c88",
  "type": "identity.user.created",
  "source": "identity",
  "subject": "7c1a4e29-8b3d-4f6a-9e05-2d8c1b7a4f63",
  "time": "2026-09-30T04:19:00Z",
  "data": {
    "user_id": "7c1a4e29-8b3d-4f6a-9e05-2d8c1b7a4f63",
    "email": "kaka@example.com"
  }
}
